{
  "mode": "READ_ONLY",
  "execution_authority": false,
  "mutation_allowed": false,
  "ticket_activation_allowed": false,
  "sequencing_allowed": false,
  "authority_class": "REPO_AUTHORITY_PROJECTION",
  "source_commit": "83a913206f23a41fb96a5eacf8d1f23ccd6e569d",
  "generated_at": "2026-10-24T00:00:00.000Z",
  "freshness": "CURRENT",
  "coverage": "COMPLETE",
  "sources": [
    {
      "source_path": "docs/ops/HEDGR_STATUS.md",
      "source_role": "CURRENT_SEQUENCE_AND_ACTIVE_AUTHORITY",
      "requirement": "MANDATORY",
      "source_classification": "REPO_AUTHORITY",
      "expected_revision": "83a913206f23a41fb96a5eacf8d1f23ccd6e569d",
      "actual_revision": "83a913206f23a41fb96a5eacf8d1f23ccd6e569d",
      "freshness_requirement": "CURRENT_REQUIRED",
      "freshness": "CURRENT",
      "structural_validation": "VALID",
      "stable_locator_support": "SUPPORTED",
      "inclusion_status": "INCLUDED",
      "reason": "Loaded from the explicit Phase 1 allow-list at the bound git commit.",
      "conflict_status": "NONE"
    },
    {
      "source_path": "AGENTS.md",
      "source_role": "REPO_EXECUTION_CONTRACT",
      "requirement": "MANDATORY",
      "source_classification": "REPO_AUTHORITY",
      "expected_revision": "83a913206f23a41fb96a5eacf8d1f23ccd6e569d",
      "actual_revision": "83a913206f23a41fb96a5eacf8d1f23ccd6e569d",
      "freshness_requirement": "CURRENT_REQUIRED",
      "freshness": "CURRENT",
      "structural_validation": "VALID",
      "stable_locator_support": "SUPPORTED",
      "inclusion_status": "INCLUDED",
      "reason": "Loaded from the explicit Phase 1 allow-list at the bound git commit.",
      "conflict_status": "NONE"
    },
    {
      "source_path": "docs/decisions/SPRINT-2-ADR-INDEX.md",
      "source_role": "ACCEPTED_ADR_INDEX",
      "requirement": "MANDATORY",
      "source_classification": "REPO_AUTHORITY",
      "expected_revision": "83a913206f23a41fb96a5eacf8d1f23ccd6e569d",
      "actual_revision": "83a913206f23a41fb96a5eacf8d1f23ccd6e569d",
      "freshness_requirement": "CURRENT_REQUIRED",
      "freshness": "CURRENT",
      "structural_validation": "VALID",
      "stable_locator_support": "SUPPORTED",
      "inclusion_status": "INCLUDED",
      "reason": "Loaded from the explicit Phase 1 allow-list at the bound git commit.",
      "conflict_status": "NONE"
    },
    {
      "source_path": "docs/doctrine/HEDGR_ACTIVE_DOCTRINE_INDEX.md",
      "source_role": "ACTIVE_DOCTRINE_SET_INDEX",
      "requirement": "MANDATORY",
      "source_classification": "REPO_AUTHORITY",
      "expected_revision": "83a913206f23a41fb96a5eacf8d1f23ccd6e569d",
      "actual_revision": "83a913206f23a41fb96a5eacf8d1f23ccd6e569d",
      "freshness_requirement": "CURRENT_REQUIRED",
      "freshness": "CURRENT",
      "structural_validation": "VALID",
      "stable_locator_support": "SUPPORTED",
      "inclusion_status": "INCLUDED",
      "reason": "Loaded from the explicit Phase 1 allow-list at the bound git commit.",
      "conflict_status": "NONE"
    }
  ],
  "conflicts": [],
  "payload": {
    "concept": "repo_authority_projection",
    "fields": {
      "active_ticket_ids": {
        "value": [
          "CLASS-A-VAL-002",
          "SE-REASON-001"
        ],
        "source_path": "docs/ops/HEDGR_STATUS.md",
        "source_section": "§7 Current active ticket status",
        "source_commit": "83a913206f23a41fb96a5eacf8d1f23ccd6e569d",
        "source_classification": "REPO_AUTHORITY",
        "freshness": "CURRENT"
      },
      "sequencing_posture": {
        "value": "RESEARCH-RELEASE-001 closes under §437 after independently verified source merge, separate independently verified sole-JSON permanent-main §364 rebind and fetched-main RAP PASS. Founder-confirmed invitations are recorded by receipt checksum only; confirmation recorded 23 Oct 2026 AWST, actual send time, channel and count unspecified. Effective §434 gate-4 FIT/PASS at dc9c44a4 and its source #1013/rebind #1014 preceded the invite-ready handoff. Under §410 D3/D4/D7, research unreleased and participant release paused lift only for the named research route and authorised pool. Founder invitation, pause and withdrawal custody remains exclusive; SME remains held. Parents CLASS-A-VAL-002 and SE-REASON-001 remain open, with no exit verdict or active nested successor; E has no nested ticket and G stays deferred. §431 bounded VoiceOver PASS remains; actual TalkBack and fractional-ZMW speech remain INCOMPLETE, never PASS. TalkBack and fractional-ZMW actual speech testing must close before the next research pass (§438 D1); this replaces the research-only non-blocking treatment for that next pass only. §409 and accepted navigation limitations remain. Post-invite fixes are carried only by verdict checksum, unactivated and not pre-staged; all other QoL and §387 deferred items remain queued only. SEC-DEPS-002 remains independently open solely for conditional 27 Oct 2026 D3 and governed closeout under unchanged §6f.27/§427/§428/§433. SEC-NODE-001 is closed under §436; §6f.29 expired with no continuing support, overlap or successor. OPS-GOV-STATUS-RESTRUCTURE-001 is the finite non-lane governance/documentation ticket under §6f.30/§438, effective only after source merge, separate independently verified sole-JSON permanent-main §364 rebind and fetched-main RAP PASS. Bounded overlap permits only remaining D3 and closeout, with no concurrent lockfile or same-file work, source records serialised on main and research priority. Steward records the effective SHA and stops under §363 without implementation. Amendment 1 (§439) corrects only R0 to the effective activation rebind 11ffe896, A5 to 100 KB = 102,400 B with the 383,394 B common-startup baseline, and spec/brief provenance; all other terms stand. Its source merge, separate independently verified sole-JSON permanent-main §364 rebind and fetched-main RAP PASS precede the existing Implementer resuming. Amendment 2 (§440) permits only the two stale metadata/authority fixtures in scripts/bridge/rap-provenance-rebind.test.mjs by proposal checksum; all other exclusions and terms stand. Its source merge, separate independently verified sole-JSON permanent-main §364 rebind and fetched-main RAP PASS precede the existing Implementer resuming. BRIDGE-MCP-001 is formally closed and retired by §438 D2. QOL-BUNDLE-001 is closed under §432; §6f.28 expired. CI-RUNNER-PIN-001 is closed under §426; §6f.26 expired. SEC-DEPS-001 is closed under §418; CODE-REVIEW-FIN-001 delivered under §419; §6f.23/§6f.24/§6f.25 expired. The observability.md:30 dev:docker mention remains a separate unauthorised follow-up. No parent closure, Lane E/G activation, broader participant exposure or financial capability follows. NO CROSS-LANE IMPACT.",
        "source_path": "docs/ops/HEDGR_STATUS.md",
        "source_section": "§7 Current active ticket status",
        "source_commit": "83a913206f23a41fb96a5eacf8d1f23ccd6e569d",
        "source_classification": "REPO_AUTHORITY",
        "freshness": "CURRENT"
      },
      "authority_boundaries": {
        "value": "Only **§7** / **§7a** name approved active ticket(s). **Default posture:** one active implementation ticket. Concurrent lanes require an accepted, active and unambiguous Founder-approved pass under §6f and explicit live lane/ticket naming, authority class, exclusions, independent stop conditions and rollback. §6e is lane-model only; §6b is Transition Readiness taxonomy, not backlog approval. Historical passes and completed briefs cannot supply current occupancy or sequencing. No lane may widen another lane's authority without a separate Founder decision and repo-native update. §6e / §6f / §6g do not widen Class B execution, custody, rails, conversion, settlement or customer-money authority. Green classification does not activate work or override §7 / §7a; no active Green delegation exists. Accepted ADRs, active doctrine, AGENTS and other current higher-precedence sources remain controlling under repo precedence. Stop and escalate genuine current-source disagreement; do not silently reconcile it.",
        "source_path": "docs/ops/HEDGR_STATUS.md",
        "source_section": "§2 Sequencing authority",
        "source_commit": "83a913206f23a41fb96a5eacf8d1f23ccd6e569d",
        "source_classification": "REPO_AUTHORITY",
        "freshness": "CURRENT"
      }
    }
  }
}
